{
  "dialect": "functional_aten",
  "model_json_sha256": "48fa8a772dcd70980008c479686c6a752ebe55a0bebe81601b06bd238405123c",
  "ops": [
    [
      "aten._native_batch_norm_legit_no_training.default",
      {
        "eps": 1e-05,
        "momentum": 0.1,
        "out_dtype": "f32",
        "out_rank": 4
      },
      52
    ],
    [
      "aten.adaptive_avg_pool2d.default",
      {
        "out_dtype": "f32",
        "out_rank": 4,
        "output_size": "[*2]"
      },
      1
    ],
    [
      "aten.add.Tensor",
      {
        "alpha": 1,
        "out_dtype": "f32",
        "out_rank": 4
      },
      10
    ],
    [
      "aten.conv2d.default",
      {
        "depthwise": false,
        "dilation": [
          1,
          1
        ],
        "groups": 1,
        "kernel": [
          1,
          1
        ],
        "out_dtype": "f32",
        "out_rank": 4,
        "padding": [
          0,
          0
        ],
        "stride": [
          1,
          1
        ]
      },
      34
    ],
    [
      "aten.conv2d.default",
      {
        "depthwise": false,
        "dilation": [
          1,
          1
        ],
        "groups": 1,
        "kernel": [
          3,
          3
        ],
        "out_dtype": "f32",
        "out_rank": 4,
        "padding": [
          1,
          1
        ],
        "stride": [
          2,
          2
        ]
      },
      1
    ],
    [
      "aten.conv2d.default",
      {
        "depthwise": true,
        "dilation": [
          1,
          1
        ],
        "groups": 16,
        "kernel": [
          3,
          3
        ],
        "out_dtype": "f32",
        "out_rank": 4,
        "padding": [
          1,
          1
        ],
        "stride": [
          1,
          1
        ]
      },
      1
    ],
    [
      "aten.conv2d.default",
      {
        "depthwise": true,
        "dilation": [
          1,
          1
        ],
        "groups": 192,
        "kernel": [
          3,
          3
        ],
        "out_dtype": "f32",
        "out_rank": 4,
        "padding": [
          1,
          1
        ],
        "stride": [
          1,
          1
        ]
      },
      4
    ],
    [
      "aten.conv2d.default",
      {
        "depthwise": true,
        "dilation": [
          1,
          1
        ],
        "groups": 288,
        "kernel": [
          3,
          3
        ],
        "out_dtype": "f32",
        "out_rank": 4,
        "padding": [
          1,
          1
        ],
        "stride": [
          1,
          1
        ]
      },
      2
    ],
    [
      "aten.conv2d.default",
      {
        "depthwise": true,
        "dilation": [
          1,
          1
        ],
        "groups": 288,
        "kernel": [
          3,
          3
        ],
        "out_dtype": "f32",
        "out_rank": 4,
        "padding": [
          1,
          1
        ],
        "stride": [
          2,
          2
        ]
      },
      1
    ],
    [
      "aten.conv2d.default",
      {
        "depthwise": true,
        "dilation": [
          1,
          1
        ],
        "groups": 48,
        "kernel": [
          3,
          3
        ],
        "out_dtype": "f32",
        "out_rank": 4,
        "padding": [
          1,
          1
        ],
        "stride": [
          2,
          2
        ]
      },
      1
    ],
    [
      "aten.conv2d.default",
      {
        "depthwise": true,
        "dilation": [
          1,
          1
        ],
        "groups": 480,
        "kernel": [
          3,
          3
        ],
        "out_dtype": "f32",
        "out_rank": 4,
        "padding": [
          1,
          1
        ],
        "stride": [
          1,
          1
        ]
      },
      3
    ],
    [
      "aten.conv2d.default",
      {
        "depthwise": true,
        "dilation": [
          1,
          1
        ],
        "groups": 96,
        "kernel": [
          3,
          3
        ],
        "out_dtype": "f32",
        "out_rank": 4,
        "padding": [
          1,
          1
        ],
        "stride": [
          1,
          1
        ]
      },
      3
    ],
    [
      "aten.conv2d.default",
      {
        "depthwise": true,
        "dilation": [
          1,
          1
        ],
        "groups": 96,
        "kernel": [
          3,
          3
        ],
        "out_dtype": "f32",
        "out_rank": 4,
        "padding": [
          1,
          1
        ],
        "stride": [
          2,
          2
        ]
      },
      2
    ],
    [
      "aten.hardtanh.default",
      {
        "max_val": 6.0,
        "min_val": 0.0,
        "out_dtype": "f32",
        "out_rank": 4
      },
      35
    ],
    [
      "aten.linear.default",
      {
        "out_dtype": "f32",
        "out_rank": 2
      },
      1
    ],
    [
      "aten.view.default",
      {
        "out_dtype": "f32",
        "out_rank": 2,
        "size": "[*2]"
      },
      1
    ]
  ],
  "schema_version": 1,
  "schemas": {
    "aten._native_batch_norm_legit_no_training.default": "_native_batch_norm_legit_no_training(Tensor input, Tensor? weight, Tensor? bias, Tensor running_mean, Tensor running_var, float momentum, float eps) -> (Tensor, Tensor, Tensor)",
    "aten.adaptive_avg_pool2d.default": "adaptive_avg_pool2d(Tensor self, SymInt[2] output_size) -> Tensor",
    "aten.add.Tensor": "add.Tensor(Tensor self, Tensor other, *, Scalar alpha=1) -> Tensor",
    "aten.conv2d.default": "conv2d(Tensor input, Tensor weight, Tensor? bias=None, SymInt[2] stride=[1, 1], SymInt[2] padding=[0, 0], SymInt[2] dilation=[1, 1], SymInt groups=1) -> Tensor",
    "aten.hardtanh.default": "hardtanh(Tensor self, Scalar min_val=-1, Scalar max_val=1) -> Tensor",
    "aten.linear.default": "linear(Tensor input, Tensor weight, Tensor? bias=None) -> Tensor",
    "aten.view.default": "view(Tensor(a) self, SymInt[] size) -> Tensor(a)"
  },
  "torch_version": "2.13.0+cpu"
}
