{
  "dialect": "functional_aten",
  "model_json_sha256": "ffb83f92ba61d6765450400ab2631604c458797e4dda4cb3aaa7c3d15906edda",
  "ops": [
    [
      "aten._unsafe_view.default",
      {
        "out_dtype": "f16",
        "out_rank": 4,
        "size": "[*4]"
      },
      16
    ],
    [
      "aten.adaptive_avg_pool2d.default",
      {
        "out_dtype": "f16",
        "out_rank": 4,
        "output_size": "[*2]"
      },
      1
    ],
    [
      "aten.add.Tensor",
      {
        "alpha": 1,
        "out_dtype": "f16",
        "out_rank": 4
      },
      27
    ],
    [
      "aten.clone.default",
      {
        "memory_format": "torch.contiguous_format",
        "out_dtype": "f16",
        "out_rank": 5
      },
      12
    ],
    [
      "aten.clone.default",
      {
        "memory_format": "torch.contiguous_format",
        "out_dtype": "f16",
        "out_rank": 6
      },
      4
    ],
    [
      "aten.clone.default",
      {
        "memory_format": null,
        "out_dtype": "f16",
        "out_rank": 2
      },
      1
    ],
    [
      "aten.clone.default",
      {
        "memory_format": null,
        "out_dtype": "f16",
        "out_rank": 4
      },
      36
    ],
    [
      "aten.conv2d.default",
      {
        "depthwise": false,
        "dilation": [
          1,
          1
        ],
        "groups": 1,
        "kernel": [
          3,
          3
        ],
        "out_dtype": "f16",
        "out_rank": 4,
        "padding": [
          1,
          1
        ],
        "stride": [
          1,
          1
        ]
      },
      2
    ],
    [
      "aten.conv2d.default",
      {
        "depthwise": false,
        "dilation": [
          1,
          1
        ],
        "groups": 1,
        "kernel": [
          4,
          4
        ],
        "out_dtype": "f16",
        "out_rank": 4,
        "padding": [
          0,
          0
        ],
        "stride": [
          4,
          4
        ]
      },
      1
    ],
    [
      "aten.gelu.default",
      {
        "approximate": "none",
        "out_dtype": "f16",
        "out_rank": 4
      },
      12
    ],
    [
      "aten.layer_norm.default",
      {
        "cudnn_enable": false,
        "eps": 1e-06,
        "normalized_shape": "[*1]",
        "out_dtype": "f16",
        "out_rank": 4
      },
      27
    ],
    [
      "aten.linear.default",
      {
        "out_dtype": "f16",
        "out_rank": 2
      },
      1
    ],
    [
      "aten.linear.default",
      {
        "out_dtype": "f16",
        "out_rank": 4
      },
      48
    ],
    [
      "aten.max_pool2d.default",
      {
        "ceil_mode": false,
        "dilation": [
          1,
          1
        ],
        "kernel_size": [
          3,
          3
        ],
        "out_dtype": "f16",
        "out_rank": 4,
        "padding": [
          1,
          1
        ],
        "stride": [
          2,
          2
        ]
      },
      2
    ],
    [
      "aten.permute.default",
      {
        "dims": [
          0,
          2,
          3,
          1
        ],
        "out_dtype": "f16",
        "out_rank": 4
      },
      6
    ],
    [
      "aten.permute.default",
      {
        "dims": [
          0,
          2,
          3,
          4,
          1
        ],
        "out_dtype": "f16",
        "out_rank": 5
      },
      12
    ],
    [
      "aten.permute.default",
      {
        "dims": [
          0,
          3,
          1,
          2
        ],
        "out_dtype": "f16",
        "out_rank": 4
      },
      6
    ],
    [
      "aten.permute.default",
      {
        "dims": [
          3,
          0,
          4,
          1,
          2,
          5
        ],
        "out_dtype": "f16",
        "out_rank": 6
      },
      12
    ],
    [
      "aten.scaled_dot_product_attention.default",
      {
        "dropout_p": 0.0,
        "enable_gqa": false,
        "is_causal": false,
        "out_dtype": "f16",
        "out_rank": 5,
        "scale": null
      },
      12
    ],
    [
      "aten.transpose.int",
      {
        "dim0": 2,
        "dim1": 3,
        "out_dtype": "f16",
        "out_rank": 6
      },
      6
    ],
    [
      "aten.unbind.int",
      {
        "dim": 0,
        "out_dtype": "f16",
        "out_rank": 5
      },
      12
    ],
    [
      "aten.view.default",
      {
        "out_dtype": "f16",
        "out_rank": 2,
        "size": "[*2]"
      },
      1
    ],
    [
      "aten.view.default",
      {
        "out_dtype": "f16",
        "out_rank": 4,
        "size": "[*4]"
      },
      2
    ],
    [
      "aten.view.default",
      {
        "out_dtype": "f16",
        "out_rank": 6,
        "size": "[*6]"
      },
      18
    ]
  ],
  "schema_version": 1,
  "schemas": {
    "aten._unsafe_view.default": "_unsafe_view(Tensor self, SymInt[] size) -> Tensor",
    "aten.adaptive_avg_pool2d.default": "adaptive_avg_pool2d(Tensor self, SymInt[2] output_size) -> Tensor",
    "aten.add.Tensor": "add.Tensor(Tensor self, Tensor other, *, Scalar alpha=1) -> Tensor",
    "aten.clone.default": "clone(Tensor self, *, MemoryFormat? memory_format=None) -> Tensor",
    "aten.conv2d.default": "conv2d(Tensor input, Tensor weight, Tensor? bias=None, SymInt[2] stride=[1, 1], SymInt[2] padding=[0, 0], SymInt[2] dilation=[1, 1], SymInt groups=1) -> Tensor",
    "aten.gelu.default": "gelu(Tensor self, *, str approximate=\"none\") -> Tensor",
    "aten.layer_norm.default": "layer_norm(Tensor input, SymInt[] normalized_shape, Tensor? weight=None, Tensor? bias=None, float eps=1.0000000000000001e-05, bool cudnn_enable=True) -> Tensor",
    "aten.linear.default": "linear(Tensor input, Tensor weight, Tensor? bias=None) -> Tensor",
    "aten.max_pool2d.default": "max_pool2d(Tensor self, int[2] kernel_size, int[2] stride=[], int[2] padding=0, int[2] dilation=1, bool ceil_mode=False) -> Tensor",
    "aten.permute.default": "permute(Tensor(a) self, int[] dims) -> Tensor(a)",
    "aten.scaled_dot_product_attention.default": "scaled_dot_product_attention(Tensor query, Tensor key, Tensor value, Tensor? attn_mask=None, float dropout_p=0., bool is_causal=False, *, float? scale=None, bool enable_gqa=False) -> Tensor",
    "aten.transpose.int": "transpose.int(Tensor(a) self, int dim0, int dim1) -> Tensor(a)",
    "aten.unbind.int": "unbind.int(Tensor(a -> *) self, int dim=0) -> Tensor(a)[]",
    "aten.view.default": "view(Tensor(a) self, SymInt[] size) -> Tensor(a)"
  },
  "torch_version": "2.13.0+cpu"
}
