{
  "dialect": "functional_aten",
  "model_json_sha256": "b755e263bc00e957e84ed380e8d3fb03cd738e86858b4b326bf32c7077a07686",
  "ops": [
    [
      "aten._native_batch_norm_legit_no_training.default",
      {
        "eps": 1e-05,
        "momentum": 0.1,
        "out_dtype": "bf16",
        "out_rank": 4
      },
      25
    ],
    [
      "aten._unsafe_view.default",
      {
        "out_dtype": "bf16",
        "out_rank": 4,
        "size": "[*4]"
      },
      6
    ],
    [
      "aten.adaptive_avg_pool2d.default",
      {
        "out_dtype": "bf16",
        "out_rank": 4,
        "output_size": "[*2]"
      },
      1
    ],
    [
      "aten.add.Tensor",
      {
        "alpha": 1,
        "out_dtype": "bf16",
        "out_rank": 4
      },
      19
    ],
    [
      "aten.clone.default",
      {
        "memory_format": "torch.contiguous_format",
        "out_dtype": "bf16",
        "out_rank": 6
      },
      6
    ],
    [
      "aten.clone.default",
      {
        "memory_format": null,
        "out_dtype": "bf16",
        "out_rank": 2
      },
      1
    ],
    [
      "aten.clone.default",
      {
        "memory_format": null,
        "out_dtype": "bf16",
        "out_rank": 4
      },
      27
    ],
    [
      "aten.conv2d.default",
      {
        "depthwise": false,
        "dilation": [
          1,
          1
        ],
        "groups": 1,
        "kernel": [
          1,
          1
        ],
        "out_dtype": "bf16",
        "out_rank": 4,
        "padding": [
          0,
          0
        ],
        "stride": [
          1,
          1
        ]
      },
      54
    ],
    [
      "aten.conv2d.default",
      {
        "depthwise": false,
        "dilation": [
          1,
          1
        ],
        "groups": 1,
        "kernel": [
          3,
          3
        ],
        "out_dtype": "bf16",
        "out_rank": 4,
        "padding": [
          1,
          1
        ],
        "stride": [
          2,
          2
        ]
      },
      1
    ],
    [
      "aten.conv2d.default",
      {
        "depthwise": true,
        "dilation": [
          1,
          1
        ],
        "groups": 112,
        "kernel": [
          3,
          3
        ],
        "out_dtype": "bf16",
        "out_rank": 4,
        "padding": [
          1,
          1
        ],
        "stride": [
          1,
          1
        ]
      },
      1
    ],
    [
      "aten.conv2d.default",
      {
        "depthwise": true,
        "dilation": [
          1,
          1
        ],
        "groups": 1344,
        "kernel": [
          3,
          3
        ],
        "out_dtype": "bf16",
        "out_rank": 4,
        "padding": [
          1,
          1
        ],
        "stride": [
          2,
          2
        ]
      },
      1
    ],
    [
      "aten.conv2d.default",
      {
        "depthwise": true,
        "dilation": [
          1,
          1
        ],
        "groups": 224,
        "kernel": [
          3,
          3
        ],
        "out_dtype": "bf16",
        "out_rank": 4,
        "padding": [
          1,
          1
        ],
        "stride": [
          2,
          2
        ]
      },
      1
    ],
    [
      "aten.conv2d.default",
      {
        "depthwise": true,
        "dilation": [
          1,
          1
        ],
        "groups": 448,
        "kernel": [
          3,
          3
        ],
        "out_dtype": "bf16",
        "out_rank": 4,
        "padding": [
          1,
          1
        ],
        "stride": [
          1,
          1
        ]
      },
      2
    ],
    [
      "aten.conv2d.default",
      {
        "depthwise": true,
        "dilation": [
          1,
          1
        ],
        "groups": 448,
        "kernel": [
          3,
          3
        ],
        "out_dtype": "bf16",
        "out_rank": 4,
        "padding": [
          1,
          1
        ],
        "stride": [
          2,
          2
        ]
      },
      1
    ],
    [
      "aten.conv2d.default",
      {
        "depthwise": true,
        "dilation": [
          1,
          1
        ],
        "groups": 672,
        "kernel": [
          3,
          3
        ],
        "out_dtype": "bf16",
        "out_rank": 4,
        "padding": [
          1,
          1
        ],
        "stride": [
          1,
          1
        ]
      },
      1
    ],
    [
      "aten.conv2d.default",
      {
        "depthwise": true,
        "dilation": [
          1,
          1
        ],
        "groups": 896,
        "kernel": [
          3,
          3
        ],
        "out_dtype": "bf16",
        "out_rank": 4,
        "padding": [
          1,
          1
        ],
        "stride": [
          1,
          1
        ]
      },
      1
    ],
    [
      "aten.conv2d.default",
      {
        "depthwise": true,
        "dilation": [
          1,
          1
        ],
        "groups": 896,
        "kernel": [
          3,
          3
        ],
        "out_dtype": "bf16",
        "out_rank": 4,
        "padding": [
          1,
          1
        ],
        "stride": [
          2,
          2
        ]
      },
      1
    ],
    [
      "aten.expand.default",
      {
        "implicit": false,
        "out_dtype": "bf16",
        "out_rank": 4,
        "size": "[*4]"
      },
      9
    ],
    [
      "aten.group_norm.default",
      {
        "cudnn_enabled": false,
        "eps": 1e-05,
        "num_groups": 1,
        "out_dtype": "bf16",
        "out_rank": 4
      },
      21
    ],
    [
      "aten.linear.default",
      {
        "out_dtype": "bf16",
        "out_rank": 2
      },
      1
    ],
    [
      "aten.mul.Tensor",
      {
        "out_dtype": "bf16",
        "out_rank": 4
      },
      18
    ],
    [
      "aten.permute.default",
      {
        "dims": [
          0,
          1,
          3,
          5,
          2,
          4
        ],
        "out_dtype": "bf16",
        "out_rank": 6
      },
      3
    ],
    [
      "aten.permute.default",
      {
        "dims": [
          0,
          1,
          4,
          2,
          5,
          3
        ],
        "out_dtype": "bf16",
        "out_rank": 6
      },
      3
    ],
    [
      "aten.relu.default",
      {
        "out_dtype": "bf16",
        "out_rank": 4
      },
      9
    ],
    [
      "aten.silu.default",
      {
        "out_dtype": "bf16",
        "out_rank": 4
      },
      25
    ],
    [
      "aten.softmax.int",
      {
        "dim": -1,
        "dtype": null,
        "out_dtype": "bf16",
        "out_rank": 4
      },
      9
    ],
    [
      "aten.split_with_sizes.default",
      {
        "dim": 1,
        "out_dtype": "bf16",
        "out_rank": 4,
        "split_sizes": "[*3]"
      },
      9
    ],
    [
      "aten.sum.dim_IntList",
      {
        "dim": [
          -1
        ],
        "dtype": null,
        "keepdim": true,
        "out_dtype": "bf16",
        "out_rank": 4
      },
      9
    ],
    [
      "aten.upsample_bilinear2d.vec",
      {
        "align_corners": true,
        "out_dtype": "bf16",
        "out_rank": 4,
        "output_size": "[*2]",
        "scale_factors": null
      },
      1
    ],
    [
      "aten.view.default",
      {
        "out_dtype": "bf16",
        "out_rank": 2,
        "size": "[*2]"
      },
      1
    ],
    [
      "aten.view.default",
      {
        "out_dtype": "bf16",
        "out_rank": 6,
        "size": "[*6]"
      },
      6
    ]
  ],
  "schema_version": 1,
  "schemas": {
    "aten._native_batch_norm_legit_no_training.default": "_native_batch_norm_legit_no_training(Tensor input, Tensor? weight, Tensor? bias, Tensor running_mean, Tensor running_var, float momentum, float eps) -> (Tensor, Tensor, Tensor)",
    "aten._unsafe_view.default": "_unsafe_view(Tensor self, SymInt[] size) -> Tensor",
    "aten.adaptive_avg_pool2d.default": "adaptive_avg_pool2d(Tensor self, SymInt[2] output_size) -> Tensor",
    "aten.add.Tensor": "add.Tensor(Tensor self, Tensor other, *, Scalar alpha=1) -> Tensor",
    "aten.clone.default": "clone(Tensor self, *, MemoryFormat? memory_format=None) -> Tensor",
    "aten.conv2d.default": "conv2d(Tensor input, Tensor weight, Tensor? bias=None, SymInt[2] stride=[1, 1], SymInt[2] padding=[0, 0], SymInt[2] dilation=[1, 1], SymInt groups=1) -> Tensor",
    "aten.expand.default": "expand(Tensor(a) self, SymInt[] size, *, bool implicit=False) -> Tensor(a)",
    "aten.group_norm.default": "group_norm(Tensor input, int num_groups, Tensor? weight=None, Tensor? bias=None, float eps=1.0000000000000001e-05, bool cudnn_enabled=True) -> Tensor",
    "aten.linear.default": "linear(Tensor input, Tensor weight, Tensor? bias=None) -> Tensor",
    "aten.mul.Tensor": "mul.Tensor(Tensor self, Tensor other) -> Tensor",
    "aten.permute.default": "permute(Tensor(a) self, int[] dims) -> Tensor(a)",
    "aten.relu.default": "relu(Tensor self) -> Tensor",
    "aten.silu.default": "silu(Tensor self) -> Tensor",
    "aten.softmax.int": "softmax.int(Tensor self, int dim, ScalarType? dtype=None) -> Tensor",
    "aten.split_with_sizes.default": "split_with_sizes(Tensor(a -> *) self, SymInt[] split_sizes, int dim=0) -> Tensor(a)[]",
    "aten.sum.dim_IntList": "sum.dim_IntList(Tensor self, int[1]? dim, bool keepdim=False, *, ScalarType? dtype=None) -> Tensor",
    "aten.upsample_bilinear2d.vec": "upsample_bilinear2d.vec(Tensor input, SymInt[]? output_size, bool align_corners, float[]? scale_factors) -> Tensor",
    "aten.view.default": "view(Tensor(a) self, SymInt[] size) -> Tensor(a)"
  },
  "torch_version": "2.13.0+cpu"
}
