{
  "dialect": "functional_aten",
  "model_json_sha256": "f4025e885d9edfa76474a7df08e6e92eb32441d5805dafec74fb9b400e8f6db0",
  "ops": [
    [
      "aten._native_batch_norm_legit_no_training.default",
      {
        "eps": 1e-05,
        "momentum": 0.1,
        "out_dtype": "f32",
        "out_rank": 4
      },
      27
    ],
    [
      "aten.adaptive_avg_pool2d.default",
      {
        "out_dtype": "f32",
        "out_rank": 4,
        "output_size": "[*2]"
      },
      1
    ],
    [
      "aten.conv2d.default",
      {
        "depthwise": false,
        "dilation": [
          1,
          1
        ],
        "groups": 1,
        "kernel": [
          1,
          1
        ],
        "out_dtype": "f32",
        "out_rank": 4,
        "padding": [
          0,
          0
        ],
        "stride": [
          1,
          1
        ]
      },
      18
    ],
    [
      "aten.conv2d.default",
      {
        "depthwise": false,
        "dilation": [
          1,
          1
        ],
        "groups": 1,
        "kernel": [
          3,
          3
        ],
        "out_dtype": "f32",
        "out_rank": 4,
        "padding": [
          1,
          1
        ],
        "stride": [
          2,
          2
        ]
      },
      1
    ],
    [
      "aten.conv2d.default",
      {
        "depthwise": true,
        "dilation": [
          1,
          1
        ],
        "groups": 128,
        "kernel": [
          5,
          5
        ],
        "out_dtype": "f32",
        "out_rank": 4,
        "padding": [
          2,
          2
        ],
        "stride": [
          1,
          1
        ]
      },
      5
    ],
    [
      "aten.conv2d.default",
      {
        "depthwise": true,
        "dilation": [
          1,
          1
        ],
        "groups": 128,
        "kernel": [
          5,
          5
        ],
        "out_dtype": "f32",
        "out_rank": 4,
        "padding": [
          2,
          2
        ],
        "stride": [
          2,
          2
        ]
      },
      1
    ],
    [
      "aten.conv2d.default",
      {
        "depthwise": true,
        "dilation": [
          1,
          1
        ],
        "groups": 16,
        "kernel": [
          3,
          3
        ],
        "out_dtype": "f32",
        "out_rank": 4,
        "padding": [
          1,
          1
        ],
        "stride": [
          2,
          2
        ]
      },
      1
    ],
    [
      "aten.conv2d.default",
      {
        "depthwise": true,
        "dilation": [
          1,
          1
        ],
        "groups": 256,
        "kernel": [
          5,
          5
        ],
        "out_dtype": "f32",
        "out_rank": 4,
        "padding": [
          2,
          2
        ],
        "stride": [
          1,
          1
        ]
      },
      1
    ],
    [
      "aten.conv2d.default",
      {
        "depthwise": true,
        "dilation": [
          1,
          1
        ],
        "groups": 32,
        "kernel": [
          3,
          3
        ],
        "out_dtype": "f32",
        "out_rank": 4,
        "padding": [
          1,
          1
        ],
        "stride": [
          1,
          1
        ]
      },
      1
    ],
    [
      "aten.conv2d.default",
      {
        "depthwise": true,
        "dilation": [
          1,
          1
        ],
        "groups": 32,
        "kernel": [
          3,
          3
        ],
        "out_dtype": "f32",
        "out_rank": 4,
        "padding": [
          1,
          1
        ],
        "stride": [
          2,
          2
        ]
      },
      1
    ],
    [
      "aten.conv2d.default",
      {
        "depthwise": true,
        "dilation": [
          1,
          1
        ],
        "groups": 64,
        "kernel": [
          3,
          3
        ],
        "out_dtype": "f32",
        "out_rank": 4,
        "padding": [
          1,
          1
        ],
        "stride": [
          1,
          1
        ]
      },
      1
    ],
    [
      "aten.conv2d.default",
      {
        "depthwise": true,
        "dilation": [
          1,
          1
        ],
        "groups": 64,
        "kernel": [
          3,
          3
        ],
        "out_dtype": "f32",
        "out_rank": 4,
        "padding": [
          1,
          1
        ],
        "stride": [
          2,
          2
        ]
      },
      1
    ],
    [
      "aten.conv2d.default",
      {
        "depthwise": true,
        "dilation": [
          1,
          1
        ],
        "groups": 8,
        "kernel": [
          3,
          3
        ],
        "out_dtype": "f32",
        "out_rank": 4,
        "padding": [
          1,
          1
        ],
        "stride": [
          1,
          1
        ]
      },
      1
    ],
    [
      "aten.hardsigmoid.default",
      {
        "out_dtype": "f32",
        "out_rank": 4
      },
      2
    ],
    [
      "aten.hardswish.default",
      {
        "out_dtype": "f32",
        "out_rank": 4
      },
      28
    ],
    [
      "aten.linear.default",
      {
        "out_dtype": "f32",
        "out_rank": 2
      },
      1
    ],
    [
      "aten.mean.dim",
      {
        "dim": [
          2,
          3
        ],
        "dtype": null,
        "keepdim": true,
        "out_dtype": "f32",
        "out_rank": 4
      },
      2
    ],
    [
      "aten.mul.Tensor",
      {
        "out_dtype": "f32",
        "out_rank": 4
      },
      2
    ],
    [
      "aten.relu.default",
      {
        "out_dtype": "f32",
        "out_rank": 4
      },
      2
    ],
    [
      "aten.view.default",
      {
        "out_dtype": "f32",
        "out_rank": 2,
        "size": "[*2]"
      },
      1
    ]
  ],
  "schema_version": 1,
  "schemas": {
    "aten._native_batch_norm_legit_no_training.default": "_native_batch_norm_legit_no_training(Tensor input, Tensor? weight, Tensor? bias, Tensor running_mean, Tensor running_var, float momentum, float eps) -> (Tensor, Tensor, Tensor)",
    "aten.adaptive_avg_pool2d.default": "adaptive_avg_pool2d(Tensor self, SymInt[2] output_size) -> Tensor",
    "aten.conv2d.default": "conv2d(Tensor input, Tensor weight, Tensor? bias=None, SymInt[2] stride=[1, 1], SymInt[2] padding=[0, 0], SymInt[2] dilation=[1, 1], SymInt groups=1) -> Tensor",
    "aten.hardsigmoid.default": "hardsigmoid(Tensor self) -> Tensor",
    "aten.hardswish.default": "hardswish(Tensor self) -> Tensor",
    "aten.linear.default": "linear(Tensor input, Tensor weight, Tensor? bias=None) -> Tensor",
    "aten.mean.dim": "mean.dim(Tensor self, int[1]? dim, bool keepdim=False, *, ScalarType? dtype=None) -> Tensor",
    "aten.mul.Tensor": "mul.Tensor(Tensor self, Tensor other) -> Tensor",
    "aten.relu.default": "relu(Tensor self) -> Tensor",
    "aten.view.default": "view(Tensor(a) self, SymInt[] size) -> Tensor(a)"
  },
  "torch_version": "2.13.0+cpu"
}
