{
  "dialect": "functional_aten",
  "model_json_sha256": "094f7026e178d382dc80bb495d52f3ddee8462688b321eb3ff0f8a6798ec1173",
  "ops": [
    [
      "aten._native_batch_norm_legit_no_training.default",
      {
        "eps": 1e-05,
        "momentum": 0.1,
        "out_dtype": "f32",
        "out_rank": 4
      },
      53
    ],
    [
      "aten.adaptive_avg_pool2d.default",
      {
        "out_dtype": "f32",
        "out_rank": 4,
        "output_size": "[*2]"
      },
      1
    ],
    [
      "aten.add.Tensor",
      {
        "alpha": 1,
        "out_dtype": "f32",
        "out_rank": 4
      },
      16
    ],
    [
      "aten.clone.default",
      {
        "memory_format": null,
        "out_dtype": "f32",
        "out_rank": 2
      },
      1
    ],
    [
      "aten.conv2d.default",
      {
        "depthwise": false,
        "dilation": [
          1,
          1
        ],
        "groups": 1,
        "kernel": [
          1,
          1
        ],
        "out_dtype": "f32",
        "out_rank": 4,
        "padding": [
          0,
          0
        ],
        "stride": [
          1,
          1
        ]
      },
      32
    ],
    [
      "aten.conv2d.default",
      {
        "depthwise": false,
        "dilation": [
          1,
          1
        ],
        "groups": 1,
        "kernel": [
          1,
          1
        ],
        "out_dtype": "f32",
        "out_rank": 4,
        "padding": [
          0,
          0
        ],
        "stride": [
          2,
          2
        ]
      },
      4
    ],
    [
      "aten.conv2d.default",
      {
        "depthwise": false,
        "dilation": [
          1,
          1
        ],
        "groups": 1,
        "kernel": [
          3,
          3
        ],
        "out_dtype": "f32",
        "out_rank": 4,
        "padding": [
          1,
          1
        ],
        "stride": [
          2,
          2
        ]
      },
      1
    ],
    [
      "aten.conv2d.default",
      {
        "depthwise": false,
        "dilation": [
          1,
          1
        ],
        "groups": 10,
        "kernel": [
          3,
          3
        ],
        "out_dtype": "f32",
        "out_rank": 4,
        "padding": [
          1,
          1
        ],
        "stride": [
          1,
          1
        ]
      },
      4
    ],
    [
      "aten.conv2d.default",
      {
        "depthwise": false,
        "dilation": [
          1,
          1
        ],
        "groups": 10,
        "kernel": [
          3,
          3
        ],
        "out_dtype": "f32",
        "out_rank": 4,
        "padding": [
          1,
          1
        ],
        "stride": [
          2,
          2
        ]
      },
      1
    ],
    [
      "aten.conv2d.default",
      {
        "depthwise": false,
        "dilation": [
          1,
          1
        ],
        "groups": 2,
        "kernel": [
          3,
          3
        ],
        "out_dtype": "f32",
        "out_rank": 4,
        "padding": [
          1,
          1
        ],
        "stride": [
          2,
          2
        ]
      },
      1
    ],
    [
      "aten.conv2d.default",
      {
        "depthwise": false,
        "dilation": [
          1,
          1
        ],
        "groups": 22,
        "kernel": [
          3,
          3
        ],
        "out_dtype": "f32",
        "out_rank": 4,
        "padding": [
          1,
          1
        ],
        "stride": [
          1,
          1
        ]
      },
      6
    ],
    [
      "aten.conv2d.default",
      {
        "depthwise": false,
        "dilation": [
          1,
          1
        ],
        "groups": 22,
        "kernel": [
          3,
          3
        ],
        "out_dtype": "f32",
        "out_rank": 4,
        "padding": [
          1,
          1
        ],
        "stride": [
          2,
          2
        ]
      },
      1
    ],
    [
      "aten.conv2d.default",
      {
        "depthwise": false,
        "dilation": [
          1,
          1
        ],
        "groups": 4,
        "kernel": [
          3,
          3
        ],
        "out_dtype": "f32",
        "out_rank": 4,
        "padding": [
          1,
          1
        ],
        "stride": [
          1,
          1
        ]
      },
      2
    ],
    [
      "aten.conv2d.default",
      {
        "depthwise": false,
        "dilation": [
          1,
          1
        ],
        "groups": 4,
        "kernel": [
          3,
          3
        ],
        "out_dtype": "f32",
        "out_rank": 4,
        "padding": [
          1,
          1
        ],
        "stride": [
          2,
          2
        ]
      },
      1
    ],
    [
      "aten.linear.default",
      {
        "out_dtype": "f32",
        "out_rank": 2
      },
      1
    ],
    [
      "aten.relu.default",
      {
        "out_dtype": "f32",
        "out_rank": 4
      },
      49
    ],
    [
      "aten.view.default",
      {
        "out_dtype": "f32",
        "out_rank": 2,
        "size": "[*2]"
      },
      1
    ]
  ],
  "schema_version": 1,
  "schemas": {
    "aten._native_batch_norm_legit_no_training.default": "_native_batch_norm_legit_no_training(Tensor input, Tensor? weight, Tensor? bias, Tensor running_mean, Tensor running_var, float momentum, float eps) -> (Tensor, Tensor, Tensor)",
    "aten.adaptive_avg_pool2d.default": "adaptive_avg_pool2d(Tensor self, SymInt[2] output_size) -> Tensor",
    "aten.add.Tensor": "add.Tensor(Tensor self, Tensor other, *, Scalar alpha=1) -> Tensor",
    "aten.clone.default": "clone(Tensor self, *, MemoryFormat? memory_format=None) -> Tensor",
    "aten.conv2d.default": "conv2d(Tensor input, Tensor weight, Tensor? bias=None, SymInt[2] stride=[1, 1], SymInt[2] padding=[0, 0], SymInt[2] dilation=[1, 1], SymInt groups=1) -> Tensor",
    "aten.linear.default": "linear(Tensor input, Tensor weight, Tensor? bias=None) -> Tensor",
    "aten.relu.default": "relu(Tensor self) -> Tensor",
    "aten.view.default": "view(Tensor(a) self, SymInt[] size) -> Tensor(a)"
  },
  "torch_version": "2.13.0+cpu"
}
