{
  "dialect": "functional_aten",
  "model_json_sha256": "2525ccbc722a6d77c05a240ba7c300a776fe5a2cba6eb53a37f1a57727f3d186",
  "ops": [
    [
      "aten._native_batch_norm_legit_no_training.default",
      {
        "eps": 1e-05,
        "momentum": 0.1,
        "out_dtype": "bf16",
        "out_rank": 4
      },
      76
    ],
    [
      "aten.adaptive_avg_pool2d.default",
      {
        "out_dtype": "bf16",
        "out_rank": 4,
        "output_size": "[*2]"
      },
      1
    ],
    [
      "aten.add.Tensor",
      {
        "alpha": 1,
        "out_dtype": "bf16",
        "out_rank": 4
      },
      21
    ],
    [
      "aten.clone.default",
      {
        "memory_format": null,
        "out_dtype": "bf16",
        "out_rank": 2
      },
      1
    ],
    [
      "aten.conv2d.default",
      {
        "depthwise": false,
        "dilation": [
          1,
          1
        ],
        "groups": 1,
        "kernel": [
          1,
          1
        ],
        "out_dtype": "bf16",
        "out_rank": 4,
        "padding": [
          0,
          0
        ],
        "stride": [
          1,
          1
        ]
      },
      97
    ],
    [
      "aten.conv2d.default",
      {
        "depthwise": false,
        "dilation": [
          1,
          1
        ],
        "groups": 1,
        "kernel": [
          3,
          3
        ],
        "out_dtype": "bf16",
        "out_rank": 4,
        "padding": [
          1,
          1
        ],
        "stride": [
          1,
          1
        ]
      },
      1
    ],
    [
      "aten.conv2d.default",
      {
        "depthwise": false,
        "dilation": [
          1,
          1
        ],
        "groups": 1,
        "kernel": [
          3,
          3
        ],
        "out_dtype": "bf16",
        "out_rank": 4,
        "padding": [
          1,
          1
        ],
        "stride": [
          2,
          2
        ]
      },
      2
    ],
    [
      "aten.conv2d.default",
      {
        "depthwise": false,
        "dilation": [
          1,
          1
        ],
        "groups": 128,
        "kernel": [
          3,
          3
        ],
        "out_dtype": "bf16",
        "out_rank": 4,
        "padding": [
          1,
          1
        ],
        "stride": [
          1,
          1
        ]
      },
      11
    ],
    [
      "aten.conv2d.default",
      {
        "depthwise": false,
        "dilation": [
          1,
          1
        ],
        "groups": 128,
        "kernel": [
          3,
          3
        ],
        "out_dtype": "bf16",
        "out_rank": 4,
        "padding": [
          1,
          1
        ],
        "stride": [
          2,
          2
        ]
      },
      1
    ],
    [
      "aten.conv2d.default",
      {
        "depthwise": false,
        "dilation": [
          1,
          1
        ],
        "groups": 192,
        "kernel": [
          3,
          3
        ],
        "out_dtype": "bf16",
        "out_rank": 4,
        "padding": [
          1,
          1
        ],
        "stride": [
          1,
          1
        ]
      },
      2
    ],
    [
      "aten.conv2d.default",
      {
        "depthwise": false,
        "dilation": [
          1,
          1
        ],
        "groups": 32,
        "kernel": [
          3,
          3
        ],
        "out_dtype": "bf16",
        "out_rank": 4,
        "padding": [
          1,
          1
        ],
        "stride": [
          1,
          1
        ]
      },
      3
    ],
    [
      "aten.conv2d.default",
      {
        "depthwise": false,
        "dilation": [
          1,
          1
        ],
        "groups": 32,
        "kernel": [
          3,
          3
        ],
        "out_dtype": "bf16",
        "out_rank": 4,
        "padding": [
          1,
          1
        ],
        "stride": [
          2,
          2
        ]
      },
      1
    ],
    [
      "aten.conv2d.default",
      {
        "depthwise": false,
        "dilation": [
          1,
          1
        ],
        "groups": 64,
        "kernel": [
          3,
          3
        ],
        "out_dtype": "bf16",
        "out_rank": 4,
        "padding": [
          1,
          1
        ],
        "stride": [
          1,
          1
        ]
      },
      5
    ],
    [
      "aten.conv2d.default",
      {
        "depthwise": false,
        "dilation": [
          1,
          1
        ],
        "groups": 64,
        "kernel": [
          3,
          3
        ],
        "out_dtype": "bf16",
        "out_rank": 4,
        "padding": [
          1,
          1
        ],
        "stride": [
          2,
          2
        ]
      },
      1
    ],
    [
      "aten.linear.default",
      {
        "out_dtype": "bf16",
        "out_rank": 2
      },
      1
    ],
    [
      "aten.mean.dim",
      {
        "dim": [
          2,
          3
        ],
        "dtype": null,
        "keepdim": true,
        "out_dtype": "bf16",
        "out_rank": 4
      },
      24
    ],
    [
      "aten.mul.Tensor",
      {
        "out_dtype": "bf16",
        "out_rank": 4
      },
      24
    ],
    [
      "aten.relu.default",
      {
        "out_dtype": "bf16",
        "out_rank": 4
      },
      24
    ],
    [
      "aten.sigmoid.default",
      {
        "out_dtype": "bf16",
        "out_rank": 4
      },
      24
    ],
    [
      "aten.silu.default",
      {
        "out_dtype": "bf16",
        "out_rank": 4
      },
      52
    ],
    [
      "aten.view.default",
      {
        "out_dtype": "bf16",
        "out_rank": 2,
        "size": "[*2]"
      },
      1
    ]
  ],
  "schema_version": 1,
  "schemas": {
    "aten._native_batch_norm_legit_no_training.default": "_native_batch_norm_legit_no_training(Tensor input, Tensor? weight, Tensor? bias, Tensor running_mean, Tensor running_var, float momentum, float eps) -> (Tensor, Tensor, Tensor)",
    "aten.adaptive_avg_pool2d.default": "adaptive_avg_pool2d(Tensor self, SymInt[2] output_size) -> Tensor",
    "aten.add.Tensor": "add.Tensor(Tensor self, Tensor other, *, Scalar alpha=1) -> Tensor",
    "aten.clone.default": "clone(Tensor self, *, MemoryFormat? memory_format=None) -> Tensor",
    "aten.conv2d.default": "conv2d(Tensor input, Tensor weight, Tensor? bias=None, SymInt[2] stride=[1, 1], SymInt[2] padding=[0, 0], SymInt[2] dilation=[1, 1], SymInt groups=1) -> Tensor",
    "aten.linear.default": "linear(Tensor input, Tensor weight, Tensor? bias=None) -> Tensor",
    "aten.mean.dim": "mean.dim(Tensor self, int[1]? dim, bool keepdim=False, *, ScalarType? dtype=None) -> Tensor",
    "aten.mul.Tensor": "mul.Tensor(Tensor self, Tensor other) -> Tensor",
    "aten.relu.default": "relu(Tensor self) -> Tensor",
    "aten.sigmoid.default": "sigmoid(Tensor self) -> Tensor",
    "aten.silu.default": "silu(Tensor self) -> Tensor",
    "aten.view.default": "view(Tensor(a) self, SymInt[] size) -> Tensor(a)"
  },
  "torch_version": "2.13.0+cpu"
}
