{
  "dialect": "functional_aten",
  "model_json_sha256": "7a57e97549736dc2c12494fa0d9c44b9217986228f5e16d8003ff3e73c6fa123",
  "ops": [
    [
      "aten.add.Tensor",
      {
        "alpha": 1,
        "out_dtype": "bf16",
        "out_rank": 4
      },
      34
    ],
    [
      "aten.alias.default",
      {
        "out_dtype": "bf16",
        "out_rank": 4
      },
      4
    ],
    [
      "aten.clone.default",
      {
        "memory_format": "torch.contiguous_format",
        "out_dtype": "bf16",
        "out_rank": 4
      },
      9
    ],
    [
      "aten.clone.default",
      {
        "memory_format": "torch.contiguous_format",
        "out_dtype": "bf16",
        "out_rank": 6
      },
      8
    ],
    [
      "aten.clone.default",
      {
        "memory_format": null,
        "out_dtype": "bf16",
        "out_rank": 2
      },
      1
    ],
    [
      "aten.clone.default",
      {
        "memory_format": null,
        "out_dtype": "bf16",
        "out_rank": 4
      },
      32
    ],
    [
      "aten.conv2d.default",
      {
        "depthwise": false,
        "dilation": [
          1,
          1
        ],
        "groups": 1,
        "kernel": [
          7,
          7
        ],
        "out_dtype": "bf16",
        "out_rank": 4,
        "padding": [
          3,
          3
        ],
        "stride": [
          4,
          4
        ]
      },
      1
    ],
    [
      "aten.gelu.default",
      {
        "approximate": "none",
        "out_dtype": "bf16",
        "out_rank": 4
      },
      16
    ],
    [
      "aten.layer_norm.default",
      {
        "cudnn_enable": false,
        "eps": 1e-06,
        "normalized_shape": "[*1]",
        "out_dtype": "bf16",
        "out_rank": 2
      },
      1
    ],
    [
      "aten.layer_norm.default",
      {
        "cudnn_enable": false,
        "eps": 1e-06,
        "normalized_shape": "[*1]",
        "out_dtype": "bf16",
        "out_rank": 4
      },
      32
    ],
    [
      "aten.linear.default",
      {
        "out_dtype": "bf16",
        "out_rank": 2
      },
      1
    ],
    [
      "aten.linear.default",
      {
        "out_dtype": "bf16",
        "out_rank": 4
      },
      67
    ],
    [
      "aten.max_pool2d.default",
      {
        "ceil_mode": false,
        "dilation": [
          1,
          1
        ],
        "kernel_size": [
          2,
          2
        ],
        "out_dtype": "bf16",
        "out_rank": 4,
        "padding": [
          0,
          0
        ],
        "stride": [
          2,
          2
        ]
      },
      6
    ],
    [
      "aten.mean.dim",
      {
        "dim": [
          1,
          2
        ],
        "dtype": null,
        "keepdim": false,
        "out_dtype": "bf16",
        "out_rank": 2
      },
      1
    ],
    [
      "aten.mul.Tensor",
      {
        "out_dtype": "bf16",
        "out_rank": 4
      },
      32
    ],
    [
      "aten.pad.default",
      {
        "mode": "constant",
        "out_dtype": "bf16",
        "out_rank": 4,
        "pad": [
          0,
          0,
          0,
          0,
          0,
          0
        ],
        "value": null
      },
      4
    ],
    [
      "aten.pad.default",
      {
        "mode": "constant",
        "out_dtype": "bf16",
        "out_rank": 4,
        "pad": [
          0,
          0,
          0,
          1,
          0,
          1
        ],
        "value": null
      },
      1
    ],
    [
      "aten.pad.default",
      {
        "mode": "constant",
        "out_dtype": "bf16",
        "out_rank": 4,
        "pad": [
          0,
          0,
          0,
          2,
          0,
          2
        ],
        "value": null
      },
      8
    ],
    [
      "aten.permute.default",
      {
        "dims": [
          0,
          1,
          3,
          2,
          4,
          5
        ],
        "out_dtype": "bf16",
        "out_rank": 6
      },
      26
    ],
    [
      "aten.permute.default",
      {
        "dims": [
          0,
          2,
          3,
          1
        ],
        "out_dtype": "bf16",
        "out_rank": 4
      },
      8
    ],
    [
      "aten.permute.default",
      {
        "dims": [
          0,
          3,
          1,
          2
        ],
        "out_dtype": "bf16",
        "out_rank": 4
      },
      6
    ],
    [
      "aten.scaled_dot_product_attention.default",
      {
        "dropout_p": 0.0,
        "enable_gqa": false,
        "is_causal": false,
        "out_dtype": "bf16",
        "out_rank": 4,
        "scale": null
      },
      16
    ],
    [
      "aten.slice.Tensor",
      {
        "dim": 1,
        "end": "*",
        "out_dtype": "bf16",
        "out_rank": 4,
        "start": "*",
        "step": "*"
      },
      9
    ],
    [
      "aten.slice.Tensor",
      {
        "dim": 2,
        "end": "*",
        "out_dtype": "bf16",
        "out_rank": 4,
        "start": "*",
        "step": "*"
      },
      9
    ],
    [
      "aten.tile.default",
      {
        "dims": "[*2]",
        "out_dtype": "bf16",
        "out_rank": 4
      },
      1
    ],
    [
      "aten.transpose.int",
      {
        "dim0": 1,
        "dim1": 2,
        "out_dtype": "bf16",
        "out_rank": 4
      },
      64
    ],
    [
      "aten.unbind.int",
      {
        "dim": 2,
        "out_dtype": "bf16",
        "out_rank": 4
      },
      16
    ],
    [
      "aten.upsample_bicubic2d.vec",
      {
        "align_corners": false,
        "out_dtype": "bf16",
        "out_rank": 4,
        "output_size": "[*2]",
        "scale_factors": null
      },
      1
    ],
    [
      "aten.view.default",
      {
        "out_dtype": "bf16",
        "out_rank": 4,
        "size": "[*4]"
      },
      48
    ],
    [
      "aten.view.default",
      {
        "out_dtype": "bf16",
        "out_rank": 5,
        "size": "[*5]"
      },
      16
    ],
    [
      "aten.view.default",
      {
        "out_dtype": "bf16",
        "out_rank": 6,
        "size": "[*6]"
      },
      26
    ]
  ],
  "schema_version": 1,
  "schemas": {
    "aten.add.Tensor": "add.Tensor(Tensor self, Tensor other, *, Scalar alpha=1) -> Tensor",
    "aten.alias.default": "alias(Tensor(a) self) -> Tensor(a)",
    "aten.clone.default": "clone(Tensor self, *, MemoryFormat? memory_format=None) -> Tensor",
    "aten.conv2d.default": "conv2d(Tensor input, Tensor weight, Tensor? bias=None, SymInt[2] stride=[1, 1], SymInt[2] padding=[0, 0], SymInt[2] dilation=[1, 1], SymInt groups=1) -> Tensor",
    "aten.gelu.default": "gelu(Tensor self, *, str approximate=\"none\") -> Tensor",
    "aten.layer_norm.default": "layer_norm(Tensor input, SymInt[] normalized_shape, Tensor? weight=None, Tensor? bias=None, float eps=1.0000000000000001e-05, bool cudnn_enable=True) -> Tensor",
    "aten.linear.default": "linear(Tensor input, Tensor weight, Tensor? bias=None) -> Tensor",
    "aten.max_pool2d.default": "max_pool2d(Tensor self, int[2] kernel_size, int[2] stride=[], int[2] padding=0, int[2] dilation=1, bool ceil_mode=False) -> Tensor",
    "aten.mean.dim": "mean.dim(Tensor self, int[1]? dim, bool keepdim=False, *, ScalarType? dtype=None) -> Tensor",
    "aten.mul.Tensor": "mul.Tensor(Tensor self, Tensor other) -> Tensor",
    "aten.pad.default": "pad(Tensor self, SymInt[] pad, str mode=\"constant\", float? value=None) -> Tensor",
    "aten.permute.default": "permute(Tensor(a) self, int[] dims) -> Tensor(a)",
    "aten.scaled_dot_product_attention.default": "scaled_dot_product_attention(Tensor query, Tensor key, Tensor value, Tensor? attn_mask=None, float dropout_p=0., bool is_causal=False, *, float? scale=None, bool enable_gqa=False) -> Tensor",
    "aten.slice.Tensor": "slice.Tensor(Tensor(a) self, int dim=0, SymInt? start=None, SymInt? end=None, SymInt step=1) -> Tensor(a)",
    "aten.tile.default": "tile(Tensor self, SymInt[] dims) -> Tensor",
    "aten.transpose.int": "transpose.int(Tensor(a) self, int dim0, int dim1) -> Tensor(a)",
    "aten.unbind.int": "unbind.int(Tensor(a -> *) self, int dim=0) -> Tensor(a)[]",
    "aten.upsample_bicubic2d.vec": "upsample_bicubic2d.vec(Tensor input, SymInt[]? output_size, bool align_corners, float[]? scale_factors) -> Tensor",
    "aten.view.default": "view(Tensor(a) self, SymInt[] size) -> Tensor(a)"
  },
  "torch_version": "2.13.0+cpu"
}
