{
  "dialect": "functional_aten",
  "model_json_sha256": "a67ad6fbd98d90d6e600371d875f501f6443cd1d1ce458d80db118a0da9939ed",
  "ops": [
    [
      "aten._native_batch_norm_legit_no_training.default",
      {
        "eps": 1e-05,
        "momentum": 0.1,
        "out_dtype": "f16",
        "out_rank": 4
      },
      53
    ],
    [
      "aten._to_copy.default",
      {
        "dtype": "torch.float16",
        "memory_format": null,
        "non_blocking": false,
        "out_dtype": "f16",
        "out_rank": 1
      },
      1
    ],
    [
      "aten._to_copy.default",
      {
        "dtype": "torch.float16",
        "memory_format": null,
        "non_blocking": false,
        "out_dtype": "f16",
        "out_rank": 2
      },
      1
    ],
    [
      "aten._to_copy.default",
      {
        "dtype": "torch.float16",
        "memory_format": null,
        "non_blocking": false,
        "out_dtype": "f16",
        "out_rank": 4
      },
      54
    ],
    [
      "aten.adaptive_avg_pool2d.default",
      {
        "out_dtype": "f16",
        "out_rank": 4,
        "output_size": "[*2]"
      },
      1
    ],
    [
      "aten.add.Tensor",
      {
        "alpha": 1,
        "out_dtype": "f16",
        "out_rank": 4
      },
      13
    ],
    [
      "aten.conv2d.default",
      {
        "depthwise": false,
        "dilation": [
          1,
          1
        ],
        "groups": 1,
        "kernel": [
          1,
          1
        ],
        "out_dtype": "f16",
        "out_rank": 4,
        "padding": [
          0,
          0
        ],
        "stride": [
          1,
          1
        ]
      },
      33
    ],
    [
      "aten.conv2d.default",
      {
        "depthwise": false,
        "dilation": [
          1,
          1
        ],
        "groups": 1,
        "kernel": [
          3,
          3
        ],
        "out_dtype": "f16",
        "out_rank": 4,
        "padding": [
          1,
          1
        ],
        "stride": [
          1,
          1
        ]
      },
      1
    ],
    [
      "aten.conv2d.default",
      {
        "depthwise": false,
        "dilation": [
          1,
          1
        ],
        "groups": 1,
        "kernel": [
          3,
          3
        ],
        "out_dtype": "f16",
        "out_rank": 4,
        "padding": [
          1,
          1
        ],
        "stride": [
          2,
          2
        ]
      },
      3
    ],
    [
      "aten.conv2d.default",
      {
        "depthwise": false,
        "dilation": [
          1,
          1
        ],
        "groups": 1,
        "kernel": [
          5,
          5
        ],
        "out_dtype": "f16",
        "out_rank": 4,
        "padding": [
          2,
          2
        ],
        "stride": [
          2,
          2
        ]
      },
      1
    ],
    [
      "aten.conv2d.default",
      {
        "depthwise": false,
        "dilation": [
          1,
          1
        ],
        "groups": 4,
        "kernel": [
          3,
          3
        ],
        "out_dtype": "f16",
        "out_rank": 4,
        "padding": [
          1,
          1
        ],
        "stride": [
          1,
          1
        ]
      },
      1
    ],
    [
      "aten.conv2d.default",
      {
        "depthwise": false,
        "dilation": [
          1,
          1
        ],
        "groups": 5,
        "kernel": [
          3,
          3
        ],
        "out_dtype": "f16",
        "out_rank": 4,
        "padding": [
          1,
          1
        ],
        "stride": [
          1,
          1
        ]
      },
      2
    ],
    [
      "aten.conv2d.default",
      {
        "depthwise": true,
        "dilation": [
          1,
          1
        ],
        "groups": 1280,
        "kernel": [
          3,
          3
        ],
        "out_dtype": "f16",
        "out_rank": 4,
        "padding": [
          1,
          1
        ],
        "stride": [
          1,
          1
        ]
      },
      1
    ],
    [
      "aten.conv2d.default",
      {
        "depthwise": true,
        "dilation": [
          1,
          1
        ],
        "groups": 1536,
        "kernel": [
          3,
          3
        ],
        "out_dtype": "f16",
        "out_rank": 4,
        "padding": [
          1,
          1
        ],
        "stride": [
          2,
          2
        ]
      },
      1
    ],
    [
      "aten.conv2d.default",
      {
        "depthwise": true,
        "dilation": [
          1,
          1
        ],
        "groups": 1920,
        "kernel": [
          3,
          3
        ],
        "out_dtype": "f16",
        "out_rank": 4,
        "padding": [
          1,
          1
        ],
        "stride": [
          1,
          1
        ]
      },
      1
    ],
    [
      "aten.conv2d.default",
      {
        "depthwise": true,
        "dilation": [
          1,
          1
        ],
        "groups": 640,
        "kernel": [
          3,
          3
        ],
        "out_dtype": "f16",
        "out_rank": 4,
        "padding": [
          1,
          1
        ],
        "stride": [
          1,
          1
        ]
      },
      3
    ],
    [
      "aten.conv2d.default",
      {
        "depthwise": true,
        "dilation": [
          1,
          1
        ],
        "groups": 768,
        "kernel": [
          3,
          3
        ],
        "out_dtype": "f16",
        "out_rank": 4,
        "padding": [
          1,
          1
        ],
        "stride": [
          1,
          1
        ]
      },
      3
    ],
    [
      "aten.conv2d.default",
      {
        "depthwise": true,
        "dilation": [
          1,
          1
        ],
        "groups": 960,
        "kernel": [
          3,
          3
        ],
        "out_dtype": "f16",
        "out_rank": 4,
        "padding": [
          1,
          1
        ],
        "stride": [
          1,
          1
        ]
      },
      3
    ],
    [
      "aten.linear.default",
      {
        "out_dtype": "f16",
        "out_rank": 2
      },
      1
    ],
    [
      "aten.relu.default",
      {
        "out_dtype": "f16",
        "out_rank": 4
      },
      34
    ],
    [
      "aten.view.default",
      {
        "out_dtype": "f16",
        "out_rank": 2,
        "size": "[*2]"
      },
      1
    ]
  ],
  "schema_version": 1,
  "schemas": {
    "aten._native_batch_norm_legit_no_training.default": "_native_batch_norm_legit_no_training(Tensor input, Tensor? weight, Tensor? bias, Tensor running_mean, Tensor running_var, float momentum, float eps) -> (Tensor, Tensor, Tensor)",
    "aten._to_copy.default": "_to_copy(Tensor self, *, ScalarType? dtype=None, Layout? layout=None, Device? device=None, bool? pin_memory=None, bool non_blocking=False, MemoryFormat? memory_format=None) -> Tensor",
    "aten.adaptive_avg_pool2d.default": "adaptive_avg_pool2d(Tensor self, SymInt[2] output_size) -> Tensor",
    "aten.add.Tensor": "add.Tensor(Tensor self, Tensor other, *, Scalar alpha=1) -> Tensor",
    "aten.conv2d.default": "conv2d(Tensor input, Tensor weight, Tensor? bias=None, SymInt[2] stride=[1, 1], SymInt[2] padding=[0, 0], SymInt[2] dilation=[1, 1], SymInt groups=1) -> Tensor",
    "aten.linear.default": "linear(Tensor input, Tensor weight, Tensor? bias=None) -> Tensor",
    "aten.relu.default": "relu(Tensor self) -> Tensor",
    "aten.view.default": "view(Tensor(a) self, SymInt[] size) -> Tensor(a)"
  },
  "torch_version": "2.13.0+cpu"
}
